<?xml version="1.0" encoding="UTF-8" ?>
<rows xmlns:xsi="http://www.w3.org/2001/XMLSchema-instance"
	xsi:noNamespaceSchemaLocation="../schema/SPORTS.xsd">
    <ROW>
        <IDNUMBER>1255</IDNUMBER>
	<SPORT_CODE_1>FBL</SPORT_CODE_1>
	<SPORT_CODE_2>GLF</SPORT_CODE_2>
	<SPORT_CODE_3></SPORT_CODE_3>
	<SPORT_CODE_4></SPORT_CODE_4>
    </ROW>
    <ROW>
        <IDNUMBER>1249</IDNUMBER>
	<SPORT_CODE_1>FBL</SPORT_CODE_1>
	<SPORT_CODE_2></SPORT_CODE_2>
	<SPORT_CODE_3></SPORT_CODE_3>
	<SPORT_CODE_4></SPORT_CODE_4>
    </ROW>
    <ROW>
        <IDNUMBER>1254</IDNUMBER>
	<SPORT_CODE_1></SPORT_CODE_1>
	<SPORT_CODE_2>GLF</SPORT_CODE_2>
	<SPORT_CODE_3></SPORT_CODE_3>
	<SPORT_CODE_4></SPORT_CODE_4>
    </ROW>
</rows>
